<?xml version="1.0" encoding="UTF-8"?>
<schema xmlns="http://www.w3.org/2001/XMLSchema" targetNamespace="http://www.zensar.com/movies" xmlns:zen="http://www.zensar.com/movies" elementFormDefault="qualified">
<element name="movies">
<complexType>
<sequence>
<element name="movie" maxOccurs="unbounded">
<complexType>
<sequence>
<element name="code">
<simpleType>
<restriction base="int">
<totalDigits value="4"></totalDigits>
<minExclusive value="5001"></minExclusive>
<maxExclusive value="6000"></maxExclusive>
</restriction>
</simpleType>
</element>
<element name="title" type="string"></element>
<element name="release-date" type="date" minOccurs="0" maxOccurs="1"></element>
<element name="theatre-name" maxOccurs="unbounded">
<simpleType>
<restriction base="string">
<minLength value="4"></minLength>
<maxLength value="20"></maxLength></restriction></simpleType></element>
<element name="city" minOccurs="0" maxOccurs="unbounded"></element>
</sequence>
</complexType>
</element>
</sequence>
</complexType>
</element>
</schema>