<?xml version="1.0" encoding="UTF-8"?>
<zen:movies xmlns:xsi="http://www.w3.org/2001/XMLSchema-instance" xmlns:zen="http://www.zensar.com/movies" xsi:schemaLocation="http://www.zensar.com/movies movies.xsd ">
  <zen:movie>
    <zen:code>5001</zen:code>
    <zen:title>zen:hawda bridge pe latki hui laash</zen:title>
    <zen:theatre-name>zen:PVR Cinemas</zen:theatre-name>
  </zen:movie>
  <zen:movie>
    <zen:code>5002</zen:code>
    <zen:title>zen:yeh jawani hai deewani</zen:title>
    <zen:theatre-name>zen:Inox</zen:theatre-name>
  </zen:movie>
</zen:movies>
